{
  "schema_version": "0.1.0",
  "result_id": "judge-metric-mismatch",
  "run_id": "stage7-semantic-invalid-run",
  "policy_ref": "examples/judges/policy.yaml",
  "policy_digest": "sha256:3ee0ad0da66bc7777c93959b76dc61740fc1652baebb937eb6ac5e3e92396071",
  "policy_id": "harness-self-test-judge-policy",
  "judge_id": "harness-self-test-reviewer",
  "produced_at": "2026-05-21T00:00:00Z",
  "effect": "advisory",
  "calibration": {
    "status": "uncalibrated",
    "labeled_sample_count": 0,
    "agreement_metric": "cohen_kappa"
  },
  "finding": {
    "severity": "warning",
    "summary": "Agreement metric mismatch.",
    "rationale": "Report validation must reject judge results calibrated with a different metric than their referenced policy.",
    "confidence": 0.4
  },
  "uncertainty_notes": ["Metric mismatch invalidates the judge result."],
  "evidence": []
}
