{
  "schema_version": "0.1.0",
  "result_id": "judge-judge-id-mismatch",
  "run_id": "judge-policy-semantic-invalid-run",
  "policy_ref": "examples/judges/policy.yaml",
  "policy_digest": "sha256:ae5b4d70fd5b7ab82be449f3ad74e36b7b8c3505a3307b260f8b704457fe3346",
  "policy_id": "harness-self-test-judge-policy",
  "judge_id": "different-judge",
  "produced_at": "2026-05-21T00:00:00Z",
  "effect": "advisory",
  "calibration": {
    "status": "uncalibrated",
    "labeled_sample_count": 0,
    "agreement_metric": "percent_agreement"
  },
  "finding": {
    "severity": "warning",
    "summary": "Judge id mismatch.",
    "rationale": "Report validation must reject judge results that name a different judge than their referenced policy artifact.",
    "confidence": 0.4
  },
  "uncertainty_notes": ["Judge identity mismatch invalidates the judge result."],
  "evidence": []
}
