{
  "schema_version": "0.1.0",
  "result_id": "judge-blocking-too-few-samples",
  "run_id": "judge-policy-semantic-invalid-run",
  "policy_ref": "examples/judges/policy.yaml",
  "policy_digest": "sha256:ae5b4d70fd5b7ab82be449f3ad74e36b7b8c3505a3307b260f8b704457fe3346",
  "policy_id": "harness-self-test-judge-policy",
  "judge_id": "harness-self-test-reviewer",
  "produced_at": "2026-05-21T00:00:00Z",
  "effect": "blocking",
  "calibration": {
    "status": "passed",
    "labeled_sample_count": 4,
    "agreement_metric": "percent_agreement",
    "agreement_score": 1,
    "calibrated_at": "2026-05-21T00:00:00Z",
    "examples": [
      { "id": "sample-1", "human_label": "acceptable", "judge_label": "acceptable" },
      { "id": "sample-2", "human_label": "unacceptable", "judge_label": "unacceptable" },
      { "id": "sample-3", "human_label": "supported", "judge_label": "supported" },
      { "id": "sample-4", "human_label": "acceptable", "judge_label": "acceptable" }
    ]
  },
  "finding": {
    "severity": "error",
    "summary": "Blocking judge has too few labeled examples.",
    "rationale": "The report validator must compare the count to the policy minimum.",
    "confidence": 0.7
  },
  "uncertainty_notes": ["Sample count below policy minimum cannot block."],
  "evidence": []
}
