{
  "schema_version": "0.1.0",
  "result_id": "judge-advisory-only-001",
  "run_id": "stage7-example-run",
  "policy_ref": "examples/judges/policy.yaml",
  "policy_digest": "sha256:16c624712971179282d2178dba74cf1be6946127b25d31677230f67e43d829f1",
  "policy_id": "harness-self-test-judge-policy",
  "judge_id": "harness-self-test-reviewer",
  "produced_at": "2026-05-21T00:00:00Z",
  "effect": "advisory",
  "calibration": {
    "status": "uncalibrated",
    "labeled_sample_count": 0,
    "agreement_metric": "percent_agreement"
  },
  "finding": {
    "severity": "warning",
    "summary": "The judge has not been calibrated against labeled examples.",
    "rationale": "Without calibration evidence, the result can guide human review but cannot block.",
    "confidence": 0.45
  },
  "uncertainty_notes": [
    "No labeled calibration sample has been recorded, so the result remains advisory-only."
  ],
  "evidence": [
    {
      "path": "examples/run-results/run-result.json",
      "media_type": "application/json",
      "description": "Run result reviewed by the uncalibrated judge."
    }
  ]
}
