{
  "schema_version": "0.1.0",
  "result_id": "judge-policy-id-mismatch",
  "run_id": "stage7-semantic-invalid-run",
  "policy_ref": "examples/judges/policy.yaml",
  "policy_digest": "sha256:16c624712971179282d2178dba74cf1be6946127b25d31677230f67e43d829f1",
  "policy_id": "different-policy",
  "judge_id": "harness-self-test-reviewer",
  "produced_at": "2026-05-21T00:00:00Z",
  "effect": "advisory",
  "calibration": {
    "status": "uncalibrated",
    "labeled_sample_count": 0,
    "agreement_metric": "percent_agreement"
  },
  "finding": {
    "severity": "warning",
    "summary": "Policy id mismatch.",
    "rationale": "Report validation must reject judge results that name a different policy than their referenced policy artifact.",
    "confidence": 0.4
  },
  "uncertainty_notes": ["Policy identity mismatch invalidates the judge result."],
  "evidence": []
}
